chpt_runs,6. Runs,,
sec_run_general,6.1. General,,
rule_run,"6.1.1. A {term:run} is a Runner's attack on a server. There are 6 phases used in the procedure of carrying out a run, described in {ref/through:sec_run_initiation,sec_run_ends_phase}. A run always begins with the Initiation Phase. {ref:Sec_steps_of_a_run} contains the full set of steps carried out during each phase, and should be referred to in conjunction with the sections discussing the phases.",,
rule_attacked_server,"6.1.2. The {term:attacked server} is the server the Runner is attempting to reach, usually to breach that server.",,
rule_announce_attacked_server,6.1.2.a. The Runner announces the attacked server in the initiation phase of the run.,,
rule_change_attacked_server,"6.1.2.b. Card abilities can sometimes change the attacked server during the run. This does not end the run, but it can affect whether or not certain card abilities or effects apply.",,
rule_change_runner_position,"6.1.2.c. If an ability changes the Runner's position, the attacked server and the current timing step of the run could also change. See {ref:rule_move_runner_to_position}.",,
rule_change_attacked_server_directly,"6.1.2.d. A few abilities change the attacked server directly, without referring to the Runner's position. These abilities do not change the current timing step of the run.",,
rule_modify_run_steps,"6.1.3. Many abilities modify the sequence of steps taken to resolve a run. Such abilities can direct players to skip steps or phases, replace steps with other effects, move directly from the current timing point to a new phase, or make other changes to the procedures explained in this section. Heed the Golden Rules in {ref:sec_golden_rules}.",,
rule_directly_approach_encounter,6.1.3.a. Some abilities direct the Runner to approach or encounter a piece of ice as part of moving them to that ice's position. See {ref:rule_move_runner_to_position}.,,
rule_approach_directly,"6.1.3.b. One card, {card:Code Replicator}, directs the Runner to approach the piece of ice in their position without first moving them to a new position. This effect changes the current timing step of the run to {ref:rule_sec_run_approach_ice_phase}, the Approach Ice Phase.",,
rule_forced_encounter_link,"6.1.3.c. An ability that directs the Runner to encounter a piece of ice without first moving the Runner's position does not change the current timing point of the run, the attacked server, or the Runner's position. The effect of such an ability is to resolve an Encounter Ice Phase independent of the current state of the run. See {ref:subsec_forced_encounters}.",,
rule_move_new_run_phase,"6.1.3.d. Any time the current timing step of the run is moved to a different phase of the run, except for an instruction to end the run (See {ref:rule_end_the_run}, below), no more steps in the previously-active phase are carried out. If a paid ability window is open, players complete that window normally. Then the active phase is complete and a checkpoint occurs. Finally, the game proceeds to the new phase.",,
rule_run_phase_after,"6.1.3.e. If a condition refers to encountering a piece of ice ""after"" an approach or passing a piece of ice ""after"" an encounter, then that condition is only met by the indicated phases or steps occurring in direct sequence according to the standard progression of the run.",,
rule_end_the_run,"6.1.4. To {term:end the run} is to halt the Runner's progress toward the server. When an effect ends the run, the current phase of the run ends without following any of its remaining steps, and before completing open priority windows. The game immediately moves from the current timing point to {ref:rule_sec_run_run_ends_phase}, the Run Ends Phase.",,
rule_jacking_out,"6.1.5. {term:Jacking out} is the process by which a Runner voluntarily ends a run. Jacking out follows the usual process for ending the run as described in {ref:rule_end_the_run}, but some card abilities function differently depending on whether or not the Runner chose to end the run by jacking out.",,
rule_jack_out_after_passing_ice,6.1.5.a. The Runner has the opportunity to jack out after passing a piece of ice.,,
rule_jack_out_before_approach,"6.1.5.b. If there is no ice protecting the server, the Runner has the opportunity to jack out before approaching the server.",,
sec_position,6.2. Position,,
rule_position,6.2.1. Each server has a sequence of {term:positions} that assign an order to ice protecting that server. A piece of ice protecting a server always occupies exactly 1 position in that server's sequence at a time.,,
rule_hosted_ice_has_no_position,"6.2.1.a. A piece of ice that is hosted on another card is not protecting a server and does not occupy a position, regardless of whether the ice is installed.",,
rule_create_position,"6.2.2. When a piece of ice is installed protecting a server or an installed piece of ice is moved, a new position is created for that ice. For ice being installed, the position is created when the Corp declares an install destination for the ice ({ref:rule_steps_installing_destination}), and the ice occupies that position once the ice becomes installed ({ref:rule_steps_installing_become_installed}). For installed ice being moved, the position is created when the movement happens, and the ice occupies that position immediately.",,
rule_create_position_outermost,"6.2.2.a. If a piece of ice is being installed in or moved to the outermost position protecting a server, the new position is outward from the outermost already-existing position. If an instruction to install a piece of ice does not explicitly specify otherwise, the ice is installed in the outermost position.",,
rule_create_position_innermost,"6.2.2.b. If a piece of ice is being installed in or moved to the innermost position protecting a server, the new position is inward from the innermost already-existing position.",,
rule_create_position_directly_inward,"6.2.2.c. If a piece of ice is being installed ""directly inward"" from another piece of ice, the new position is inward from that ice's position, and outward from the next already-existing position inward, if there is one.",,
rule_create_position_any_position,"6.2.2.d. If a piece of ice is being installed ""in any position"", the new position can be created outward from all existing positions, inward from all existing positions, or between any two existing consecutive positions, as the Corp chooses.",,
rule_create_position_mutate,"6.2.2.e. One card, {card:Mutate}, has an ability that installs a piece of ice in the ""same position"" as a particular piece of ice that was previously trashed. This is a different usage of ""same position"" from that described in {ref:rule_count_positions}. For this installation, the ice is installed protecting the same server the trashed ice was protecting, and the new position is created at the same place in that server's sequence of positions as the position the trashed ice had.",,
rule_create_position_swap,"6.2.2.f. If a piece of ice is swapped with a piece of ice protecting a server, no new position is created. The first ice will occupy the position previously held by the second ice (and vice-versa, if the first piece of ice was also protecting a server).",,
rule_count_positions,"6.2.3. Some abilities refer to ice in the ""same position"" protecting different servers. Two pieces of ice occupy the ""same position"" if their respective servers have the same number of positions inward from their respective positions.",,
rule_destroy_position,"6.2.4. If a piece of ice leaves its position, except by being swapped with another piece of ice, its former position ceases to exist. This happens during {ref:step_checkpoint_vacant_position} of the next checkpoint, unless the Runner is in that position, in which case the position continues to exist until the Runner moves to another position or ceases to have a position.",,
rule_position_runner,"6.2.5. During a run, the Runner occupies the attacked server's positions.",,
rule_position_initial,6.2.5.a. The Runner enters the outermost position protecting the attacked server at {ref:step_runner_position} of the Initiation Phase.,,
rule_position_progression,"6.2.5.b. The Runner progresses through the positions of the attacked server in order. While the Runner occupies a position, they approach, encounter (if the ice is rezzed), and pass the ice in that position, then they proceed to the next position moving inward, until they complete this process for the innermost position or the run is ended.",,
rule_no_position_after_innermost_ice,"6.2.5.c. Once the Runner leaves the innermost position protecting a server, they no longer have a position. This occurs at {ref:step_move_position} of the Movement Phase. However, abilities can still move the Runner to a position later in that phase.",,
rule_no_position_after_approach_server,"6.2.5.d. During the Success Phase and the Run Ends Phase, the Runner has no position and can no longer move to a position.",,
rule_no_position_outside_run,"6.2.5.e. The Runner does not have a position while they are not engaged in a run, nor do they maintain their position from one run to the next.",,
rule_ice_change_can_affect_position,"6.2.6. The Runner's current position is a specific element of the sequence of positions, not an index into that sequence. Adding or removing other positions protecting the attacked server does not affect the Runner's position.",,
rule_ice_change_outward,"6.2.6.a. If a position outward from the Runner's current position is added to the attacked server, the Runner will normally not need to approach or encounter the new piece of ice to reach the server.",,
rule_ice_change_inward,"6.2.6.b. If a position inward from the Runner's current position is added to or removed from the attacked server, the ice the Runner will need to approach and/or encounter changes accordingly.",,
rule_ice_change_current_position,"6.2.7. Changes to the piece of ice in the Runner's current position can affect the progression of the run, but they do so differently during an encounter than outside of an encounter.",,
rule_ice_change_approach_uninstall_move,"6.2.7.a. If a piece of ice is uninstalled or moved to another position (protecting this or another server) while it is being approached, the approach ends and the run continues to the Movement Phase.",,
rule_ice_change_approach_swap,"6.2.7.b. If a piece of ice currently being approached is swapped with another piece of ice, the Runner remains in their current position and the run remains in the Approach Ice Phase. The Runner is now approaching the new piece of ice occupying that position. Trigger conditions related to a piece of ice being approached are not met for the new ice.",,
rule_ice_change_encounter_uninstall_derez,"6.2.7.c. If a piece of ice is uninstalled or derezzed while it is being encountered, the Encounter Phase ends and the run continues to the Movement Phase.",,
rule_ice_change_encounter_move_swap,"6.2.7.d. If a piece of ice currently being encountered moves to another position or is swapped with installed ice in another position, the Runner remains with the encountered ice and continues the run from that ice's new position.",,
rule_ice_change_during_movement,"6.2.7.e. If the piece of ice in the Runner's position is uninstalled, derezzed, moved, or swapped during the Initiation Phase or the Movement Phase, the Runner is not moved and the current timing step of the run does not change.",,
rule_move_runner_to_position,"6.2.8. During a run, abilities can move the Runner directly to a position.",,
rule_move_to_piece_of_ice,"6.2.8.a. If an ability instructs the Runner to move to a piece of ice in a different position, the Runner's position becomes the position corresponding to that ice, and the server that ice protects becomes the attacked server. The current timing step becomes {ref:rule_sec_run_approach_ice_phase}, the Approach Ice Phase, or {ref:rule_sec_run_encounter_ice_phase}, the Encounter Ice Phase, according to whether the Runner was directed to approach or encounter the ice.",,
rule_move_to_specific_position,"6.2.8.b. If an ability instructs the Runner to move to ""the outermost position"" of a server, that server becomes the attacked server. If there is any ice protecting that server, the Runner's position becomes the position of the outermost such piece of ice, and the current timing step becomes {ref:rule_sec_run_approach_ice_phase}, the Approach Ice Phase. If there is no ice, the Runner ceases to have a position, and the current timing step becomes {ref:rule_sec_run_movement_phase}, the Movement Phase.",,
rule_ineffective_move,"6.2.8.c. If an ability instructs the Runner to move to a position during the Success Phase, during the Run Ends Phase, or while there is no run in progress, instead the Runner does nothing. See {ref:rule_no_position_after_approach_server}.",,
rule_move_to_current_ice,"6.2.8.d. If an ability instructs the Runner to move to and approach a position they are already approaching, instead the Runner does nothing.",,
sec_run_initiation,6.3. Initiation,,
rule_run_initiation_phase,6.3.1. The {term:initiation phase} sets the parameters for the run and begins the run.,,
rule_start_initiation_phase,"6.3.2. At the start of the Initiation Phase, the Runner announces a server to be the attacked server.",,
rule_cannot_run_abilities,"6.3.2.a. Some abilities state that the Runner ""cannot run on"" or ""cannot initiate a run on"" certain servers under certain conditions. These effects refer to the announcement of the attacked server in the Initiation Phase.",,
rule_additional_cost_to_run,"6.3.2.b. Some abilities impose an additional cost to run, either generally or on a particular server. Any costs to run a server must be paid at the time that server is announced as the attacked server.",,
rule_initiation_bad_publicity,"6.3.3. After the attacked server is announced, the Runner receives credits equal to the number of bad publicity the Corp has. See {ref:sec_bad_publicity} for an explanation of bad publicity.",,
rule_bad_publicity_cost_to_run,"6.3.3.a. Credits from bad publicity cannot be spent to pay costs to make the run, as they are received after the attacked server is announced.",,
rule_bad_publicity_in_credit_pool,"6.3.3.b. Once they are received, credits from bad publicity are in the Runner's credit pool and behave just as any other credits. They can be spent, lost, placed on cards, and so on as normally allowed.",,
rule_bad_publicity_gone_in_run_ends_phase,"6.3.3.c. During the Run Ends Phase, any credits from bad publicity remaining in the Runner's credit pool are lost.",,
rule_abilities_during_a_run,"6.3.4. Some abilities look for particular conditions occurring ""during a run"" or are restricted to being used ""during a run."" For purposes of abilities, the run formally begins only after the attacked server is announced and any costs are paid.",,
rule_run_initiation_phase_next_phase,"6.3.5. When the Initiation Phase completes, the run moves either to the Approach Ice Phase ({ref:sec_approach_ice_phase}) or the Movement Phase ({ref:sec_movement_phase}). If there is ice protecting the attacked server, the Runner's position becomes the outermost piece of ice, and the run proceeds to the Approach Ice Phase. If there is no ice protecting the server, then the run moves directly to the Movement Phase.",,
sec_approach_ice_phase,6.4. Approach Ice,,
rule_approach_ice_phase,6.4.1. The {term:approach ice phase} gives the Corp the opportunity to rez the ice in the Runner's current position.,,
rule_approach_condition,"6.4.2. For purposes of meeting trigger conditions, the Runner approaching a piece of ice is equivalent to the Approach Ice Phase beginning at that ice's position. Abilities with this trigger condition are subject to {ref:rule_reaction_window_closing_timing_structure}.",,
rule_rez_ice_restriction,"6.4.3. The paid ability window in {ref:step_approach_paw} of the Approach Ice Phase is the only time the Corp can normally rez ice. In this window, the Corp only gains the ability to rez the piece of ice being approached, not any other ice.",,
rule_approach_ice_next_phase,"6.4.4. When the Approach Ice Phase completes, the run moves either to the Encounter Ice Phase ({ref:sec_encounter_ice_phase}) or the Movement Phase ({ref:sec_movement_phase}). If the approached piece of ice is rezzed, the Runner encounters it next. If the approached piece of ice is unrezzed or if there is no longer ice installed in that position, then the run moves directly to the Movement Phase.",,
sec_encounter_ice_phase,6.5. Encounter Ice,,
rule_encounter_ice_phase,"6.5.1. The {term:encounter ice phase} gives the Runner the opportunity to interact with the ice in their current position, then requires the Corp to resolve unbroken subroutines on that ice.",,
rule_encounter_condition,"6.5.2. For purposes of meeting trigger conditions, the Runner encountering a piece of ice is equivalent to the Encounter Ice Phase beginning at that ice's position. Abilities with this trigger condition are subject to {ref:rule_reaction_window_closing_timing_structure}.",,
rule_encounter_unbroken_sub_status,"6.5.3. As each encounter begins, each subroutine on the encountered ice gains an ""unbroken"" status associated with that encounter. See {ref:sec_subroutines} for details.",,
rule_encounter_break_paw,"6.5.4. During the paid ability window in the Encounter Ice Phase ({ref:step_encounter_paw}), the Runner can break subroutines on the ice. See {ref:rule_break_subroutine}.",,
rule_encounter_sub_resolve,"6.5.5. After the paid ability window in the Encounter Ice Phase closes, unbroken subroutines on the encountered ice resolve. See {ref:rule_resolve_unbroken_subroutines}.",,
rule_encounter_ice_next_phase,"6.5.6. At the end of the Encounter Ice Phase, the run continues to the Movement Phase, {ref:sec_movement_phase}.",,
subsec_fully_break,6.5.7. Fully Break,,
rule_fully_break,"6.5.7.a. During each encounter, the Runner {term:fully breaks} the encountered ice the first time all subroutines on that ice are broken.",,
rule_object_fully_break,"6.5.7.b. Whenever the Runner fully breaks a piece of ice, if all its subroutines were broken using abilities on a single object, that object also {term:fully breaks} the ice.",,
rule_fully_break_no_subroutines,"6.5.7.c. If an encountered piece of ice has no subroutines, the Runner fully breaks it when {ref:step_encounter_paw} of the encounter begins. No objects fully break the ice in this case.",,
rule_fully_broken_not_retracted,"6.5.7.d. If the encountered piece of ice gains subroutines after the Runner fully breaks it, the Runner's status of having fully broken the ice remains in place. Conditions that check whether the Runner fully broke the ice will still be met as normal. Breaking the new subroutines will not fully break the ice or meet related conditions again.",,
subsec_bypass,6.5.8. Bypass,,
rule_bypass,"6.5.8.a. When an effect allows the Runner to {term:bypass} a piece of ice, the Encounter Ice Phase is aborted and the Runner immediately proceeds to pass that ice.",,
rule_bypass_start_of_encounter,"6.5.8.b. Most bypass effects occur at the beginning of an encounter and result in {ref:step_encounter_paw,step_resolve_subroutine} never occurring, meaning that subroutines on the encountered ice are neither broken nor resolved.",,
rule_bypass_during_encounter,"6.5.8.c. A few bypass effects can be triggered later. If ice is bypassed in {ref:step_encounter_paw}, subroutines may or may not have been broken, but {ref:step_resolve_subroutine} never occurs so no subroutines resolve. Note that for ice with zero subroutines, the Runner has ""broken all subroutines"" if and only if {ref:step_encounter_paw} was reached. See {ref:rule_vacuous_truth}.",,
subsec_forced_encounters,6.5.9. Forced Encounters,,
rule_forced_encounter,"6.5.9.a. If an ability directs the Runner to encounter a piece of ice without first changing their position, resolve an Encounter Ice Phase but do not change the Runner's position, if any. After the encounter, return to the effect that caused the encounter and proceed from there. This type of encounter outside the normal progression of a run is referred to as a {term:forced encounter}.",,
rule_forced_encounter_during_run,"6.5.9.b. If a forced encounter occurs during a run, an instruction to end the run during that encounter is applied to both the Encounter Ice Phase being resolved and the phase from which the additional encounter was initiated. If a forced encounter occurs outside of a run, an instruction to end the run simply closes the Encounter Ice Phase and returns the game to the effect that called for the encounter.",,
rule_forced_encounter_end,6.5.9.c. An instruction that creates a forced encounter is not finished resolving until the encounter is complete.,,
rule_move_during_forced,"6.5.9.d. During a forced encounter, if an ability moves the Runner or directs the Runner to approach a piece of ice, that movement resolves and changes the parameters of the underlying run normally, but does not end or interfere with the forced encounter.",,
sec_movement_phase,6.6. Movement,,
rule_movement_phase,"6.6.1. The {term:movement phase} handles the progression of the run between pieces of ice and after the innermost piece of ice, up to the point when the Runner approaches the attacked server.",,
rule_pass_ice,"6.6.2. If the Movement Phase was reached from the Approach Ice Phase or the Encounter Ice Phase, the Runner passes the ice in their position.",,
rule_jack_out_movement_phase,"6.6.3. During each Movement Phase, the Runner has the opportunity to jack out. See {ref:rule_jacking_out}.",,
rule_runner_continues,"6.6.4. If the Runner declines to jack out, their position moves to the next inward position if there is one.",,
rule_runner_approach_new_position,"6.6.5. If the Runner moves to a new position, the run continues from the Movement Phase to the Approach Ice Phase, {ref:sec_approach_ice_phase}. The Runner will approach the piece of ice in their new position.",,
rule_approach_server,"6.6.6. If the Runner does not jack out or return to the Approach Ice Phase, they approach the server. This has no inherent effects, but is referred to by some card abilities. After the Runner approaches the server, the run continues to the Success Phase, {ref:sec_success_phase}.",,
sec_success_phase,6.7. Success,,
rule_success_phase,6.7.1. The {term:success phase} declares the run successful and allows the Runner to breach the attacked server.,,
rule_successful_run,6.7.2. A run during which the runner breaks through the Corp's defenses and reaches the server itself is declared a {term:successful run}. This label is frequently referred to by card abilities.,,
rule_declaring_successful_run,"6.7.3. Declaring a run to be successful is not the same as the Success Phase beginning. Accordingly, abilities that have trigger conditions related to a successful run are not subject to {ref:rule_reaction_window_closing_timing_structure}.",,
rule_if_successful,"6.7.4. Many abilities that initiate a run contain a conditional ability with the trigger condition ""If successful"". This means, ""After the run created this way becomes successful"".",,
rule_if_successful_tied_to_server,"6.7.4.a. If an effect that initiates a run specifies that that run must be made against a specific server or servers, any ""If successful"" abilities associated with that effect are tied to that server or servers. If the attacked server has changed since the run was initiated, and no longer is a server that could have been chosen for this run, the ""If successful"" abilities do not meet their trigger conditions.",,
rule_if_successful_lingering_effect,"6.7.4.b. ""If successful"" abilities frequently create lingering effects (see {ref:sec_lingering_effects}) that modify the procedure for accessing cards or replace breaching the attacked server with another effect entirely. These effects apply to the breach permitted by the rules for this run (see {ref:rule_breach_link}), and they expire when the run is complete.",,
rule_if_successful_ability_optional,"6.7.4.c. If an ""If successful"" effect gives the Runner an effect they can optionally carry out instead of breaching, that decision is made at the time the breach would begin, in {ref:step_breach}.",,
rule_breach_link,"6.7.5. When the Runner breaches the server, they follow the procedures detailed in {ref:chpt_access_breach}.",,
sec_run_ends_phase,6.8. Run Ends Phase,,
rule_run_ends_phase,6.8.1. The {term:run ends phase} formalizes the end of the run and prepares the game to return to the timing structure from which the run was initiated.,,
rule_run_ends_process_priority_windows,"6.8.2. At the beginning of the Run Ends Phase, the game processes each priority window that was open when the run was ended. This is done according to the following procedure:",,
rule_run_ends_close_paws,"6.8.2.a. If a paid ability window was open when the run was ended, the window closes. No player can trigger further paid abilities or resolve other options the window would normally allow (such as rezzing cards).",,
rule_run_ends_close_reaction_window,"6.8.2.b. If the run was ended during a reaction window opened due to a phase beginning, the reaction window closes, as per {ref:rule_reaction_window_closing_timing_structure}. No other pending abilities are resolved.",,
rule_run_ends_other_priority_windows,"6.8.2.c. Any other open priority window is completed normally. If more than one priority window needs to be completed this way, they are resolved in the usual order described in {ref:rule_resolve_ability}.",,
rule_run_ends_lose_bad_pub_credits,"6.8.3. During the Run Ends Phase, if the Runner has any credits from bad publicity remaining in their credit pool, the Runner loses those credits.",,
